city,company,jobs,description
"Philadelphia, PA",,Lyft Driver (No Experience Needed),"Signing up to be a Lyft driver is the perfect opportunity for you to earn extra cash - whether you're trying to offset costs of your car, cover this month's..."
"Philadelphia, PA",Lyft,Livery Drivers Wanted,"We supply the vehicle so you only need a valid clean drivers license, an out going personality, and a strong desire to earn money while driving people where..."
"Philadelphia, PA",AllThrees,Package Handler - Part-Time,"Part-time Ramp Ground Handlers work outside on either the day or night ramp operation and must have a valid driver’s license This is a physical, fast paced..."
"Malvern, PA",,Part Time Member Service Representatives (see below for loca...,"Acts as receptionist or teller when necessary. Computer, typewriter, adding machine, facsimile machine, photocopier, and telephone...."
"Philadelphia, PA",UNITED PARCEL SERVICE,RECEPTIONIST,Welcome visitors and answer their requests in a professional manner. Receive and forward phone calls appropriately....
"Abington, PA",,"Librarian / Trainer, Medical Library, FT, Days, Mon-Fri (ALA...","Valid driver's license and current registration. Must possess a driving record free from major violations within the past five years, and maintain an acceptable..."
"Huntingdon Valley, PA",Abington Memorial Hospital,Professional House Cleaner,"Must have reliable transportation with driver's license and insurance. We accept everyone who has no experience at cleaning houses, has professionally cleaned..."
"North Wales, PA",Pazeto Cleaning Service,Seasonal Retail Receiving** Part Time: Macy's Montgomery PA,"The Seasonal Retail Receiving Associate is responsible for providing a great shopping experience, and driving sales and profit through customer service and..."
"Jenkintown, PA",,Part Time Member Service Representatives (see below for loca...,"Acts as receptionist or teller when necessary. Computer, typewriter, adding machine, facsimile machine, photocopier, and telephone...."
"Huntingdon Valley, PA",Macy's,Student Services Associate 2,"Apply knowledge of principles, practices, and procedures of a particular field of specialization to complete difficult assignments;..."
"Boyertown, PA",Chestnut Knoll Personal Care Community,Care Assistant,"Answer pages through out each shift when residents call for help. Help serve meals in the dining room, assist with activities when required and work as a team..."
"Oaks, PA",QMES,Customer Service Supervisor,"Must have valid Pennsylvania driver’s license. Work near moving mechanical parts, outdoor weather conditions, and risk of electrical shock...."
"Oaks, PA",,Operations Analyst for Client Investor Services,"We are an Equal Opportunity Employer and do not discriminate against any employee or applicant for employment because of race, color, sex, age, national origin,..."
"Topton, PA",SEI,Production Worker,"We have a career opportunity for you in the energy production field, no experience is required we will train you...."
"Oaks, PA",,Kennel Assistant,"Located in Pottstown, PA. The Animal Inn at French Creek Veterinary Hospital is looking for a friendly, animal-loving Part-Time Kennel Assistant to work in an..."
"Pottstown, PA",,Class A CDL OTR Truck Driver,About Big G
"Bethlehem, PA",Big G,Mobile Trailer Mechanic,", Inc.:. At Big G"
"Blue Bell, PA",Express,Pharmacy Director of Operations,we offer:. Big G
"Wayne, PA",,Production Worker,is a 100% employee owned company that has been in business for over 21 years....
"Douglassville, PA",JB Hunt,CO manager,"If you are unable to apply, please"
"Cranbury, NJ",,Account Specialist,"Inventory Management, Supply Chain, Finance, Credit & Collections, I&C, Sales and Sales Operations, Transportation and Distribution...."
"Monmouth Junction, NJ",L'Oreal USA,Picture Framer,"Applicant must also be good with measurements and able to work with hand tools. Metaverse Corporation is a South Brunswick, NJ based Internet retailer with 40..."
"Monmouth Junction, NJ",Metaverse Corporation,Lab Assistant,"This may be an excellent opportunity for a ""local"" person with some available time/ flexibility & interested to learn or interested to stay active with..."
"Cranbury, NJ",AcceleDev Chemical LLC,In-Process QA Associate (3rd shift),Perform incoming inspections and outgoing inspections of finished product batches. Data Entry of Finished Product Information into the APR (Annual Product...
"Dayton, NJ",,Collision Center Receptionist (South Brunswick),"Valid driver’s license and satisfactory Motor Vehicle Report. Answers dealership group phones. Communicates with callers and visitors in a professional,..."
"Chester County, PA",Brian's House Inc,Direct Care Counselors & Day Program Instructors - Caregiver...,"Experience preferred, but not necessary • High school diploma/GED required • Must have a valid driver's license and reliable transportation • Physical ability..."
"Honey Brook, PA",Century Park Associates,RECEPTIONIST,"Operates kitchen within state and county regulations including sanitation, food storage, record keeping, food temperatures, portion sizes, chemical usage..."
"Coatesville, PA",,"Child/Adolescent Care - 6pm Friday- 9:30pm Sunday, $772. Hou...","Career, Compensation, Employment, Full Time, Job Board, Job Description, job Search, Job Search, Jobs, Occupation, Opening, Part Time, Salary, Schedule, Shift,..."
"Exton, PA",Milton Hershey School,(2) Full-time Custodian,"Possess a valid Pennsylvania driver's license. Operate buffer, floor-care machines, vacuums, drills, and other small power tools...."
"Exton, PA",,Courier (DOT),Must be licensed for type of vehicle assigned. Answers customer questions on FedEx features of service and keeps customers informed about the company and its...
"Downingtown, PA",,Therapeutic Staff Support (TSS),CCRES is an industry leader working in partnership with the Home and Community Services (H&CS) program of the
"Berwyn, PA",,Legal Administrative Assistant,Daily review and prioritization of correspondence Coordinate and arrange meetings and schedules Schedule conference calls and on-site/off-site meetings Answer...
"Philadelphia, PA",TE CONNECTIVITY,Director of Administrative Services,"Supervises the Administrative Services Department which includes receptionist and other various administrative services employees in the areas of Documentation,..."
"Philadelphia, PA",EwingCole,Finance Business Partner,Support development and implementation of analytical tools. Develop and analyze pricing and discounts strategy....
"Philadelphia, PA","Spark Therapeutics, Inc.",Lead Support Worker (Saturday-Wednesday 10:00pm-6:00am),"Under the Supervision of the Generations Director, the Generations Lead Support Worker provides leadership to assure residential services(Generation I) are of..."
"Philadelphia, PA",,"Payroll Administrator - West Chester, PA","""I live in and/or am applying for a job in a state that does not require an answer at this time."". YOU WILL BE ASKED TO ANSWER THE CRIMINAL HISTORY QUESTIONS..."
"Philadelphia, PA",Orr Protection Systems,Fire Alarm Technician,"Required license or certification:. Uniforms, tools, laptop computer, cell phone, credit card and a company vehicle will be provided...."
Pennsylvania,,Work From Home French Speaking Customer Service Team Leader,"Absolute passion for ensuring a great customer experience with every contact · 2 years previous experience supervising, motivating and driving an engaging..."
"Philadelphia, PA",Amazon.com,Multi-Unit Manager / Area Supervisor,"Required license or certification:. Equipment and Facilities Management, Appearance, Ambiance, Safety and Security of guests, associates and restaurant assets...."
Pennsylvania,APS Mgmt (DBA Dunkin Donuts),Patient Services Associate,"The PSA is responsible for the arrival and/or departure activities of patients in the practice, managing and handling patient calls and inquiries, coordinating..."
"Philadelphia, PA",,Identity & Access Management Coordinator,"Completes the data entry of information required for provisioning University ID cards for affiliated groups such as contractors, ELS students and housekeeping..."
"Conshohocken, PA",,B2B Account Executive,We do not accept resumes from external staffing agencies or independent recruiters for any of our openings unless we have a signed recruiting agreement in place...
"Philadelphia, PA",Swift Capital,Customer Service Representative,Calls customers when necessary to advise shipments delay and/or information necessary to process orders. Strong data entry and typing skills....
"West Reading, PA",,Clerk - Labor & Delivery,"Duties include assisting with departmental operations and handling clerical tasks such as sorting mail, filing, answering phones, greeting visitors, scheduling..."
"Philadelphia, PA",Unique Industries,(2) Full-time Custodian,"Possess a valid Pennsylvania driver's license. Operate buffer, floor-care machines, vacuums, drills, and other small power tools...."
"Philadelphia, PA",,Production Worker,"We have a career opportunity for you in the energy production field, no experience is required we will train you...."
"Bethlehem, PA",,Rheumatology Opportunity 60 miles north of Philadelphia,We see great need with exceptional growth potential for this service line and are looking to develop a world class program....
"Kennett Square, PA",,Specialist-Mental Health RecMS,"Master's degree in Social Work, Psychology, Nursing, Counseling or related field required, licensed in respective discipline...."
"Leesport, PA",Genesis Healthcare,Rehab Office Coordinator,Certification as a Nursing Assistant is also preferred (unless required by state). Completes technical audits of charts ensuring all documentation is present....
"Quakertown, PA",,Unit Assistant,10.3 Answer telephone and/or place calls as directed. 4.1 Transport customers to the Dining Room to designated seating assignment....
"Kennett Square, PA",Genesis Healthcare,Administrative Assistant (hourly),"Whether you are working to enhance clinical skills or develop leadership capabilities, we actively support your goals...."
"Wyncote, PA",,Residential Aide,"A current and valid driver’s license is required for community based homes. Work involves providing individualized care, activities of daily living, including..."
"Allentown, PA",NHS Human Services,Psych Tech I,"Adhere to all NHS Human Services, County, State, and Federal policies and regulations related to mental health treatment services...."
"Lafayette Hill, PA",,Recruiter,"Identify, develop & maintain relationships with user groups, networking organizations and best practice communities of assigned areas of professional..."
"Bethlehem, PA",NHS Human Services,Administrative Assistant Full Time 37.5 hours,Answer telephones and relay information to recovery team express self as appropriate for first agency contact person....
"Woodbridge, NJ",,Delivery Driver,"You’ll also need a valid driver’s license, at least 2 years of driving experience, proof of insurance (listed as a covered driver) and reliable vehicle ..."
"Ewing, NJ",Pizza Hut,Shift Leader,"And, you’re at least 18 years old with a valid driver’s license, reliable transportation (not public transportation – you may need to drive to make deposits for..."
"Vineland, NJ",Pizza Hut,Team Member,"It’s about being independent and having fun, making new friends and earning extra cash. And independently-owned franchised or licensed locations may have..."
"Springfield, PA",,Executive Team Leader (Assistant Store Manager) Human Resour...,"Develop a strong training culture and makes sure company tools and programs are consistently implemented. Strong cognitive skills, including problem analysis,..."
"Pottstown, PA",TARGET,Executive Team Leader (Assistant Store Manager) Montgomery C...,"Your responsibilities will include opening and closing the store on assigned days, recruiting and hiring your team, and creating a positive experience for..."
"Edison, NJ",,Executive Team Leader (Assistant Store Manager) Guest Exerie...,"As an Executive Team Leader - Guest Experience, you'll take the lead as you… Drive sales by overseeing the guest service experience throughout the entire store..."
"Springfield, PA",TARGET,Online Order Fulfillment Team Member,Help drive sales by pulling merchandise quickly and accurately Package and ship merchandise to guests using proper equipment and techniques Lift 40 pounds...
"Springfield, PA",,Human Resource Team Member,"Develop a fast, fun and friendly team. Target merchandise discount. Quickly and accurately scan and bag all items and collect payment...."
"Philadelphia, PA",,"Manager, Central Processing Department","Working for this leading academic medical center means collaboration with top clinical, technical and business professionals across all disciplines...."
"Philadelphia, PA",University of Pennsylvania Health System,Manager of Operations - MRI,"A bachelor’s degree in a healthcare related field required. Working for this leading academic medical center means collaboration with top clinical, technical..."
"Philadelphia, PA",,Manager of Operations - Radiology,"A bachelor’s degree in a healthcare related field required. Working for this leading academic medical center means collaboration with top clinical, technical..."
"Lakehurst, NJ","George Hildebrandt, Inc",Flatbed Driving Jobs for Company Drivers,"2 Years Tractor Trailer Driving Experience. Possessing year-round freight, we understand what truck driving is all about...."
"Lakehurst, NJ","George Hildebrandt, Inc",Flatbed Driving Jobs | Drop and Hook Freight,"2 Years Tractor Trailer Driving Experience. Possessing year-round freight, we understand what truck driving is all about...."
"Plymouth Meeting, PA",,Distribution System Dispatcher I - PECO,"Associates in technical field / High School diploma or equivalent AND a minimum of 2 years of job experience, preferably in the electrical field...."
"Plymouth Meeting, PA",Exelon,"Communication Technician 1, Installation & Service","Ability to use basic cable installation tools and hand tools and. Provides written and field assessments, meeting/exceeding Comcast. Performs service calls...."
"Plymouth Meeting, PA",,Teller I (20hrs) - Plymouth Meeting,"Processes regular Teller transactions for Customers including servicing Customer accounts, accepting loan payments, accepting safe deposit box payments,..."
"Plymouth Meeting, PA",Comcast,Front Desk/Host,Our front desk and host position ensures Guests' initial impressions with Dave & Buster's are positive and welcoming....
"Plymouth Meeting, PA",,Office Administrative Assistant,"Prepare materials for client meetings, conference calls, etc. This position reports to and works closely with Executive Level Management, initiating..."
"Malvern, PA",,Customer Service Representative (3 Days Off),"Take incoming calls from customers who are placing orders, inquiring about our products, returning product, etc. Enter and process orders/returns Answer..."
"Malvern, PA","Turn 5, Inc.",Clinical Sales Representative,Make between 40 and 60 outbound calls daily. The Surgical and Clinical Sales Representatives manage and grow a geographical territory of surgical and clinical...
"Malvern, PA","Accutome, Inc.",After School Elementary Assistant Teachers,"Supervision of children indoor and outdoor, serving snack, greeting parents, homework supervision and supervising club activities...."
"Malvern, PA","Warwick Child Care Center, Inc.",Admission Database/Operations Assistant,Assist in answering phones in Visitor Center and provide direction to on-site visitors. The primary responsibilities of the individual in this position is to...
"Malvern, PA",,Backroom Team Member,"Keep merchandise organized and accessible. Work as part of a fast, fun and friendly Backroom team. Maintain a clean, great-looking store. Quickly and..."
"Lahaska, PA",Left Bank Home,Part Time Sales Associate Home Furnishings and Gifts,"Offer customers exemplary service and create a friendly welcoming atmosphere through greeting, engaging, and providing accurate product information...."
"Lancaster, PA",WeBuyAnyCar USA,Automotive Sales Representative,"Valid, state-issued driver’s license with a clean driving record and no “major” violations during the past three (3) years including, but not limited to, DUI..."
"Philadelphia, PA",,M-Retail Sales Associate,"Furthermore, such discrimination or harassment may violate federal, state, or local law. All decisions concerning the employment relationship will be made..."
"Philadelphia, PA",MetroPCS,Travel Agent,"Our own in-house Learning Center - We will provide you with all the tools you need to get up and running, as well as ongoing training to further develop your..."
"Conshohocken, PA",,"Unit Coordinator, Labor and Delivery","Responsible for general office management, clerical and receptionist duties on the Nursing Unit. Calls the Siemens Help Desk on behalf of staff and initiates..."
"Philadelphia, PA",Wicresoft NA,Project Manager/Scheduler,"Knowledge of approaches, tools, and techniques for design and development of paper-based and online technical reference documentation, guidelines, standards,..."
"Flourtown, PA",Riders' Club Cooperative,Drivers--Part Time,"Earn $18-$42 per hour giving rides to frail seniors, school children and the handicapped in your own reliable car or minivan starting September...."
"Freehold, NJ",Opusing LLC,Document Prep Specialist 1,Bent corners or folded pages are also straightened to allow the sheet to be laid flat. This component accounts for about 60% of shift hours if the position is...
"Marlton, NJ",,Industrial Specialist (General),"The Defense Contract Management Agency serves as the independent eyes and ears of the Department of Defense (DoD) and its partners, delivering actionable..."
"Philadelphia, PA",,Operations Specialist Level III - Banking - Retirement Produ...,"This position is being recruited for by Adecco’s Engineering and Technical Service Delivery Center, not your local Adecco Branch Office...."
"Media, PA",ASD - Answering Service for Directors,2nd Shift Answering Service Rep (Part time),"Dependable team player attitude with an understanding that calls cannot be delayed and must be handled immediately, including weekends, holidays, and days with..."
"Breinigsville, PA",The Home Depot,General Warehouse Associates,"What does it take to coordinate the flow of hundreds of thousands of products to the front doors of over 2.2 million customers? RDC – Breinigsville, PA*...."
"Philadelphia, PA",,Call Center Representative - Day Shift,Present yourself in a very professional manner. Our reps contact and screen qualified participants for focus groups around the nation....
"Philadelphia, PA",Focus Pointe Global,Part Time Member Service Representatives (see below for loca...,"Acts as receptionist or teller when necessary. Computer, typewriter, adding machine, facsimile machine, photocopier, and telephone...."
"Philadelphia, PA",,Program Ambassador Philadelphia,Independent university research has demonstrated the positive impact our program has on student literacy rates....
"Bensalem, PA",Rothman Orthopaedic Specialty Hospital,Orderly,"Cooperative work attitude toward and with co-employees, management, patients, visitors and physicians, and ability to effectively communicate with others...."
"Dover, DE",Admissions-Long Term Care,Admissions,"Perform all pre-admission processes, all admission processes, census procedures, discharge procedures, maintain up-to-date financial knowledge of the financial..."
"Philadelphia, PA",,Accounts Payable Associate,Process invoices for payment. Scan/enter invoices into AP workflow management system. Process payment to vendors in a timely manner....
"Livingston, NJ","Dietz & Watson, Inc.",(2) Full-time Custodian,"Possess a valid Pennsylvania driver's license. Operate buffer, floor-care machines, vacuums, drills, and other small power tools...."
"Philadelphia, PA",,In-Process QA Associate (3rd shift),Perform incoming inspections and outgoing inspections of finished product batches. Data Entry of Finished Product Information into the APR (Annual Product...
"Philadelphia, PA",MLD Mortgage Inc dba The Money Store,Loan Originator,"Mortgage bank expanding into Philadelphia and seeking experienced loan originators. Leads provided, amazing branch support loan officer friendly systems."
"Philadelphia, PA",ABIM,Quality Analyst,"Position Summary:  The Quality Analyst (QA) will assess agent performance/behavior in the call center, coach and counsel agents to modify their performance"
"Conshohocken, PA",,General Manager,"General Manager Join the First Transit team as a General Manager and initiate, develop, and maintain a successful contract relationship! The General Manager"
"Marlton, NJ",First Transit,Project Scheduler,"Project SchedulerJob Summary Under direct supervision, assists in daily coordination of project schedules including preparing and maintaining project plans,"
"Philadelphia, PA",,Production Supervisor,This is an exciting opportunity with a large food and beverage manufacturing company in the Southern NJ area. The position will be full-time/direct hire and
"Bensalem, PA",,REGN/LOCAL DEDICATED DRIVER MIDATL-F,"Must be able to successfully pass a post offer physical agility test, specifically designed for the tasks associated with the position...."
"Easton, PA",Ward Trucking,BIM Project Coordinator,"Experience with Excel, MS Word, MS Project required. Advise the CPS BIM Manager on a weekly basis on status of all assigned projects and assist with project..."
"Glen Mills, PA",,Marketing Coordinator,"Proficiency in Microsoft Office, Powerpoint and Excel. Proficiency in Adobe Products – Dreamweaver, Photoshop, Illustrator and Indesign...."
"Conshohocken, PA",Victaulic,Manager of Visitor Services,"The Museum is seeking an experienced manager to ensure the highest quality visitor experience for Museum visitors and members at the Main Building, Perelman..."
Pennsylvania,New Carbon Company LLC,Benefits Coordinator,Perform regular audits of Administrative Staff and Direct Care Workers’ files to ensure benefit compliance with state and federal regulations in accordance with...
"Bala-Cynwyd, PA",,"Junior Recruiter - Bala Cynwyd, PA","Provide administrative support to the branch by completing payroll and audits. When you join our team as a Junior Recruiter, you’ll be responsible for assisting..."
"Conshohocken, PA",Integrity Staffing Solutions,Management Trainee,"Regardless of college major or professional experience, nearly 100% of our full-time employees start out in our Management Training Program. This allows"
"Parsippany, NJ",,Help Desk Technician (Level II),Who are we? Workforce Opportunity Services (WOS) launches technology and business careers for recent college graduates and military veterans. We partner with
"Philadelphia, PA",Enterprise Rent-A-Car,Direct Placement Counselor,"Job Descriptions: Scope of Position * Overall responsibility for building business relationships with current, former and new employer customers in the"
"Philadelphia, PA",,MANAGEMENT ASSISTANT (OFFICE AUTOMATION),"Budgetary, financial, and administrative duties. The Navy and Marine Corps team offers innovative, exciting and meaningful work linking military and civilian..."
"Newtown Square, PA",Insomnia Cookies,New Manager Coordinator,"Insomnia Cookies was founded in a college dorm room in 2003 at the University of Pennsylvania, by then student, Seth Berkowitz and we have been feeding the"
"Philadelphia, PA",,Provider Relations Representative (Medicare/Medicaid/Managed...,"SUMMARY: The Provider Relations Representative (Network Ops SR Analyst) develops and maintains positive relationships with physicians, providers, and"
"Philadelphia, PA",Cigna,Case Distribution Specialist,"Simon & Simon, PC is a rapidly expanding, full-service personal injury law firm assisting injured victims and their families. We are currently looking for a"
"Lakewood, NJ","Simon & Simon, PC",Laborers: Philadephia Airport Area,General Contractor looking for skilled laborers to fill the following positions for current work in progress Immediate need for: - Concrete Flat Work
"Philadelphia, PA",,Merchandise Planner and Allocator,"To apply, please submit a cover letter and resume with your application..."
"Pleasantville, NJ",,Technical Writer/Technician Level 2,"Job Description: The Technical Writer/Technician Level 2 researches and writes professional documents related to the National Aerospace System/NAS, including"
"Wayne, PA",ECS,Customer Experience Associate,General Summary:  To perform sales and operational support functions to meet or exceed the needs and expectations of the NBD team through accurate order
"Bensalem, PA","Corporate Interiors, Inc",Expos - Opening Soon in Bensalem!,"At Metro Diner , we're a family of high volume, fast paced, from scratch restaurants that are committed to high quality service, innovative food, and a"
"Philadelphia, PA",,"Part-Time, Temporary Inpatient Clerk Positon","Requirements: ***PLEASE NOTE THAT THERE ARE SEVERAL POSITIONS AVAILABLE AND THEY ARE ""TEMPORARY"" ONLY. ***** High school diploma or equivalent. Clerical"
"Malvern, PA",Metro Diner,Laborers: Philadephia Airport Area,General Contractor looking for skilled laborers to fill the following positions for current work in progress Immediate need for: - Concrete Flat Work
"Norristown, PA",,Animal Care Camp Counselor,"NO PHONE CALLS PLEASE. Must be willing to clean up messes, supervise play groups, feed, medicate, and monitor health and behavior...."
