description,city,company,jobs
"If you answered YES to all of the above I think Snap Kitchen might just be for you. First of all Snap Kitchen would like to say, You’re Welcome!...","Philadelphia, PA",,Packager
"Is an Equal Opportunity Employer.All qualified applicants will receive consideration for employment without regard to race, color, national origin, religion,...","Philadelphia, PA",,Hiring Retail Event Stock Associate
"Ladders used include twelve foot ladders. Bed Bath & Beyond is remodeling the Plymouth Meeting, PA location!...","Plymouth Meeting, PA",,Temporary Overnight Retail Associate Positions
_A fast and growing Home Care Agency in North Philadelphia is looking for a full time Front Desk Receptionist /Data Entry Clerk to join its workforce._....,"Abington, PA",,Receptionist /Data Entry Clerk
"No phone calls please. At times, data entry and updating the website may be required, so attention to detail and communicating with our team is very important....","Easton, PA",,Customer Service Representative for Office Position
"FULL TIME DOCK WORKERS NEEDED FOR PM SHIFT Central Transport is seeking quality dock workers out of our Lawrenceville, NJ terminal. *CENTRAL TRANSPORT Offers","Trenton, NJ",Central Transport,Dock Worker/Forklift Operator (Central Transport)
Has a minimum undergraduate GPA of 2.75 for certification requirements (3.0 preferred). Develop and coach all of our teachers through *weekly observations and...,"Trenton, NJ",The Foundation Academies,High School English Teacher 2016-17
Has a minimum undergraduate GPA of 2.75 for certification requirements (3.0 preferred). Develop and coach all of our teachers through *weekly observations and...,"Trenton, NJ",The Foundation Academies,Reading Teacher 2016-17
"Technical Resource Specialist. Under the direction of the Billing Unit supervisor, the temporary Claims Eligibility Specialist will be responsible for being...","Trenton, NJ",,Claims Eligibility Specialist (1446810714)
"FULL TIME DOCK WORKERS NEEDED FOR PM SHIFT Central Transport is seeking quality dock workers out of our Lawrenceville, NJ terminal. *CENTRAL TRANSPORT Offers","Trenton, NJ",,Dock Worker/Forklift Operator (Central Transport)
"FRONT DESK/MARKETING ASSISTANT. Background/experience in exercise science, massage therapy, physical therapy, or personal training preferred but not required....","West Chester, PA",INTEGRATIVE HEALTH,2 POSITIONS - FRONT DESK / MARKETING ASSISTANT & FRONT DESK...
"Required license or certification:. Must have a valid Driver's License. Duties include managing all Social Media for the company, as well as client emails,...","West Chester, PA",Sidelines Sportswear & Promotions,Social Media/Account Executive
"Our company delivers world-class building operations, facility maintenance and janitorial services by providing clients with state of the art equipment and...","West Chester, PA",,Accounting Specialist
Assisting receptionist by answering phone and email inquiries and other duties as needed. Assisting with aspects of verification and entry of prospect data...,"West Chester, PA",,Clerk 2 - Office of Admissions
"Description Description: To review individual job descriptions, please visit http://careers.gamestop.com/career-areas/retail-staff-jobs/ and select the","West Chester, PA",,Retail Staff (Store 6692)
"The medical assistant must be able to rotate, if needed to front desk duties, in the event of vacation/illness....","Mount Laurel, NJ",Dermatology Associates of South Jersey,Medical Assistant
Communicate with guests and employees both verbally and in writing to answer questions and provide clear direction in advising and instructing staff in details...,"Mount Laurel, NJ",,Front Office Manager
"Are you interested in working for a company that offers benefits for full-time permanent employees, flex schedules and the opportunity to grow with the company?...","Mount Laurel, NJ",,Call Center Representative
"Description Description: To review individual job descriptions, please visit http://careers.gamestop.com/career-areas/retail-staff-jobs/ and select the","Mount Laurel, NJ",,Retail Staff (Store 0629)
"Must have a valid driver’s license. Employees of Vivint Solar must submit to a criminal history check, motor vehicles check, drug screening, and obtain...","Mount Laurel, NJ",,Meter Reader
"After running away with the prestigious Better Business Bureau's 2013 Torch Award, Nu Look Home Design has exploded into the marketplace as one of the most...","Cherry Hill, NJ",,Entry-Level Sales/Marketing Representative
"A valid driver’s license and reliable vehicle. DEFENDERS is Ranked #27 in the world for our successful learning and development programs, we offer countless...","Cherry Hill, NJ",,Outside Sales Technician - Security Sales
"You also educate your team members about products, while independently keeping your own technical know-how up to date....","Cherry Hill, NJ",,Genius - Technical Customer Service (US)
"Our own in-house Learning Center - We will provide you with all the tools you need to get up and running, as well as ongoing training to further develop your...","Cherry Hill, NJ",,Travel Agent
"Description Description: To review individual job descriptions, please visit http://careers.gamestop.com/career-areas/retail-staff-jobs/ and select the","Cherry Hill, NJ",,Retail Staff (Store 5136)
Your career as a Presorter at Pitney Bowes will help you increase your technical skills in the mailing industry to rapidly move into other positions within...,"Reading, PA",,1st Shift Presorter (6\:45am-3\:00pm)
Greet all patients and visitors and answer phones. This position is also responsible for Receptionist duties....,"Reading, PA",,Receptionist - Maidencreek Urgent Care - Part Time - Evening...
"Basic computer knowledge including, but not limited to, Microsoft Office and SAP -Knowledge of safety related issues, including compliance with State, Federal...","Reading, PA",,Production Supervisor
"Penske Truck Leasing Co., L.P., headquartered in United State is a joint venture among Penske Corporation, Penske Automotive Group and General Electric....","Reading, PA",,"Customer Service, Scheduling Coordinator (PB)"
Must be licensed for type of vehicle assigned. Answers customer questions on FedEx features of services and keeps customers informed about the company and its...,"Reading, PA",,Courier (Non-DOT)
"Medical, Dental, Prescription Plan, 401(K) plus matching, Short and Long Term Disability, Supplemental Health Insurance and Life Insurance....","Newark, DE",,Outside Sales Representative / Account Manager
"Able to communicate on the telephone with proper etiquette. Proactively create enhanced shopping experiences through the heightened use of tools, technology and...","Newark, DE",,"Retail Sales, Full Time: Newark, DE, Macy's Christiana"
Work with property management team on annual budgets and capital improvement forecasting. Assist CPA by providing all documents & information for tax prep &...,"Newark, DE",Commerical Real Estate Management Company,ACCOUNTANT / BOOKKEEPER - FULL TIME
The Clerk will provide clerical support and assume responsibility and accountability for front office activities in an office practice....,"Newark, DE",,Clerk VI Job
"They are responsible for answering questions and resolving problems on a wide range of issues, including account activation inquiries, potential fraudulent...","Newark, DE",,Processing Specialist
"Copiers and printers, and arrange service calls when maintenance is needed. Voucher entry accurately & timely daily. Attain checks from Cash....","Bethlehem, PA",,"Support Assistant - Appleton, WI or Bethlehem, PA"
"Watches out for co-workers and warn them when there are any safety issues or hazards. Report all discrepancies, damages and other issues to supervisor....","Bethlehem, PA",Phillips Pet Food & Supplies,Valley Pet Picker - 1st Shift
"Warehouse, warehousing, shipping, receiving, receiver, dock, laborer, manual labor, entry level, transportation, distribution, general labor, freight handler,...","Bethlehem, PA",,Sort Observation for Package Handler
"Perform all functions of event staff• Welcome event guests, provide proper information on how their day will run• Assist event hosts with checking in/out guests...","Bethlehem, PA",,Event Assistant
"Description Description: To review individual job descriptions, please visit http://careers.gamestop.com/career-areas/retail-staff-jobs/ and select the","Bethlehem, PA",,Retail Staff (Store 6995)
Must Possess Valid PA Driver’s License. Drivers will load and unload their own parcels within the route assigned....,"King of Prussia, PA",American Transportation Management (ATM),Package Delivery Driver -- Philadelphia
Ability to develop constructive working and interpersonal relationships with colleagues and adventurers. Smile and a friendly greeting....,"King of Prussia, PA",Escape Room Mystery - Adventure Guide,Adventure Guide - Escape Room Mystery
We offer the unique opportunity to work on some of the most inspiring and interesting pharmaceutical products and technologies within the medical field as a...,"King of Prussia, PA",AlphaBioCom,Scientific Editor
Data Entry / Research Support (Full- or Part-Time). You’re not afraid to dive into Excel spreadsheets or immerse yourself in a growing nationwide database....,"King of Prussia, PA",,Data Entry / Research Support (Full- or Part-Time)
"The PSA is responsible for the arrival and/or departure activities of patients in the practice, managing and handling patient calls and inquiries, coordinating...","King of Prussia, PA",,Patient Services Associate
Valid Driver's License required. Act as first level technical support and triage all incoming requests as needed....,"Princeton, NJ",,Onsite Support Technician
"2020 trains its teams to succeed in any environment, and equips them with the best technology and training to be flexible, engaging, and adept at solving...","Princeton, NJ",,Sales Rep Verizon Fios - FT
"Providing active care management for our clients, answering their questions, conducting periodic home visits, and coordinating with their families....","Princeton, NJ",Home Care Partners,Home Care - Client Manager
"Responsible for greeting and welcoming patients at front desk, answering phones and taking accurate messages, collecting copays and past due balances,...","Princeton, NJ",,medical office receptionist
"Additional support will include assistance in logistics and announcements of seminars and special events, and provide support to international research...","Princeton, NJ",,Faculty Assistant
"Proficient typing and data entry and computer skills; The position coordinates work within the departments, as well as with other units and departments, reports...","Allentown, PA",,"Administrative Assistant, Finance Department"
"High school diploma or equivalent and valid driver's license. 3 to 5 years commercial office maintenance experience, especially in general plumbing and...","Allentown, PA",Uline,Building Maintenance Technician
"Eastern Metal Recycling (EMR) is seeking a Scale Operator to join our Allentown, PA facility. As a Scale Operator, you will have the opportunity to learn the...","Allentown, PA",Eastern Metal Recycling (EMR),Scale Operator
Log calls and inquiries into the HR Case Management database. The incumbent will have primary responsibility for managing calls and inquiries from employees and...,"Allentown, PA",,HR SERVICES ASSOCIATE
"MUST be able to pass Background check,FBI fingerprint and Child Abuse clearance. We are currently hiring for a Assistant Group Supervisor/ Teacher Assistant....","Allentown, PA",,Daycare Assistant Teacher
"As an Advanced Service Coordinator at Capital One, you would have the opportunity to positively impact our customers by providing excellent customer service via...","Wilmington, DE",,Customer Experience and Sales Specialist - Full Time ($15.96...
"Collects, analyzes and processes information and data, and prepares relevant reports for state and federal agencies to maintain funding and licensing for...","Wilmington, DE",,Child Development Center Manager
"Our Quality Control Field Inspector conducts on-site reviews of residential properties, oversees a large GSE foreclosure program, and assists in various...","Wilmington, DE",Assero Services,Property Preservation Home Inspector
"O Performs advanced, diversified and confidential secretarial and administrative duties, i.e. prepare correspondence/reports, screen calls, maintain appointment...","Wilmington, DE",,Administrative Assistant
"Use independent judgement and discretion to ensure compliance with all state and federal codes, regulations, and laws that pertain to the position....","Wilmington, DE",,Skip Tracer/Collector
We have plenty of work and if you are an employee of a company and want to look into starting your own business opportunitiy or work for an independent...,"Philadelphia, PA",Spirit Delivery,In Home Delivery Teams / Drivers
"Good driving record. If your answers are YES, you need to send in your resume!! Great income and incentives. Professional demeanor and appearance....","Philadelphia, PA","P.J. Fitzpatrick, Inc.",Sales Representatives
"Required license or certification:. By interweaving academic content through interdisciplinary instruction and connecting it to environmental themes, or ...","Philadelphia, PA",Green Woods Charter School,Chief Executive Officer
_A fast and growing Home Care Agency in North Philadelphia is looking for a full time Front Desk Receptionist /Data Entry Clerk to join its workforce._....,"Philadelphia, PA",,Receptionist /Data Entry Clerk
"In addition, this individual is tasked with creating presentations, updating manuals and coordinating mass mailings.This position is also responsible for...","Philadelphia, PA",,Receptionist/Administrative Assistant
"Must be able to provide a valid driver’s license, clean driving record, and valid car insurance (no speeding tickets). Required license or certification:....","Philadelphia, PA",BODYARMOR Sports Drink,Brand Ambassador Intern
Seeking highly organized candidate for marketing. Responsibilities also include administrative work i.e.: data entry / scheduling . Hours are flexible. Job...,"Millburn, NJ",Gianna Giacona Beauty Group,Marketing Assistant (Part-time)
"Through this powerful link, advertisers are able to obtain the highest quality leads while publishers enjoy the addition of an upgraded revenue stream that will...","Township of Warren, NJ",Digital Advertising,Product Review Writer
"Is an independent, healthy, happy living company based in Emmaus, Pennsylvania and New York, New York. Duties include assisting with various tasks for both...","Township of Warren, NJ",,Editorial Assistant Internship
"Greeting visitors to the office. Manage conference room and call line schedules. The internship will last from August 1, 2016 to November 18, 2016....","Wayne, PA",,For Our Future Internship: PA Operations
"Come see for yourself and meet some of the successful, dynamic individuals who make up our winning team.*. Reserve your seat to meet Wyndham’s Top Marketing and...","Stroudsburg, PA",Club Wyndham at Shawnee Village,SUMMER CAREER EVENT!!
"2-4 year degree, preferably in a technology or computer-related field or equivalent experience in a help-desk, technical support, or other computer related role...","Newtown, PA",MMS Education,Help Desk Tier 1 Support / Seasonal/Temporary
Answer phones and assist customers Prepare payoff letters Assist account officers with questions Distribution of daily reports....,"Kingston, NJ",,Loan Operations Processor (FULL-TIME TEMPORARY)
Bucks County –based online music retailer looking for temporary workers to help efficiently pack and ship orders....,"Bristol, PA",,Temporary Shipping / Packing Help
Possess a valid state approved driver's license or identification card. Possess a valid original state vehicle registration (if driving) to be allowed to park...,"New Providence, NJ",,Workplace Assistant
Answer incoming calls or make out bound calls to customers who wish to cancel their program. This position receives program cancellation requests via inbound...,"Fort Washington, PA",Nutrisystem,Retention Sales Representative- Account Management $65-75K
"Required license or certification:. Seaview Beverage is a non alcoholic beverage distributor located in central New Jersey, we're looking for a motivated sales...","Lakewood, NJ",Seaview Beverage,Sales Representative
Supportive Management to help YOU succeed. The All New DCN Hyundai (formerly Brad Benson Hyundai)....,"Monmouth Junction, NJ",DCN Hyundai,Automotive Sales Professional
"National real estate investment group looking to grow in the Philadelphia & Surrounding Areas, there is no better place to start than with the *#1 Real Estate...","Jenkintown, PA",,10 Top Sales Representatives Needed $20K + A Month Potential...
No phone calls please. We are one of the largest auto groups in NC. Chevy dealership on Airport Rd*. We are hiring!...,"Feasterville-Trevose, PA",,Sales Associate/Customer Service Representative
"Resumes submitted to any Sun employee by a third party agency and/or search firm without a valid written & signed search agreement, will become the sole...","Cranbury, NJ",,Packaging Operator (First Shift)
"What does it take to coordinate the flow of hundreds of thousands of products to the front doors of over 2.2 million customers? RDC – Breinigsville, PA*....","Breinigsville, PA",The Home Depot,General Warehouse Associates
"Do you have a valid PA Drivers License? Do you have a valid driver's license? General filing – along with maintaining the filing system, removing older files as...","Bensalem, PA",,Office Assistant
"With a heavy focus on data entry for customer billing, customer collections and answering calls on a multi-line system....","Jenkintown, PA",,Office Administration
"Answer public inquiries pertaining to PennDOT regulations and driver’s license and vehicle registration applications, providing advice on licensing policies,...","Township of Wall, NJ",,"Clerk, Retail Pennsylvania Tag and Title Clerk"
"We pride ourselves on our outstanding service to agents and customers throughout our field offices across the U.S., and in Mexico, Canada, Brazil, UK, Australia...","Plymouth Meeting, PA",,Financial Systems Analyst - Liberty Mutual Surety - Finance
"Our auto damage claims adjusters provide outstanding customer service on a daily basis by working in local drive-in locations, GEICO Auto Repair Xpress shops...","Philadelphia, PA",,"Auto Damage Trainee, Philadelphia, PA"
"Supervises the Administrative Services Department which includes receptionist and other various administrative services employees in the areas of Documentation,...","Easton, PA",,Director of Administrative Services
Certified Forklift License a plus. Coca-Cola Refreshments is an Equal Opportunity Employer and does not discriminate against any employee or applicant for...,"Pine Grove, PA",,"General Labor Lead, Warehouse"
"Various automated systems and tools for use by human resources staff and others such as e-OPF, USA Staffing, eQIP, WebHR, VetPro, local HR SharePoint, etc., in...","Woodbridge, NJ",,Human Resources Officer
"This candidate must be able to develop and utilize reports regarding attendance, overtime and agency usage to assist with scheduling needs and troubleshoot with...","Philadelphia, PA",,Staffing Coordinator Full-Time 5:00PM-1:00AM
"Requests auto insurance documents through phone calls and faxes. For consideration please submit your resume through the Indeed link.\*No phone calls, please....","Philadelphia, PA",Center City Law Firm,Records Procurement Specialist
"Answer multi-line phone. Filing, scanning, copying, faxing. Occasional hand deliveries/errand runs....","Sinking Spring, PA",,Part-time Receptionist
"Answering and appropriately routing all incoming communications via phone, email and postal mail. Familiarity and experience with social justice, human rights...","Philadelphia, PA",,Office Manager
"Briefly state the objective of this position. Accountable for the project management, complete oversight and timely delivery of clinical trial data and...","Media, PA",,Global Clinical Data Manager
"You will need to speak to customers about a product's different features, and answer any questions they might have....","Philadelphia, PA",MyChannel,Sales Manager
"As a growing company, we’re looking for like-minded people who are looking to consistently win—that means people with grit, pride, compassion + focus to help...","New Brunswick, NJ",,RESTAURANT TEAM MEMBER
"Current FBI, Pennsylvania State Police, and Department of Public Welfare criminal and child abuse clearances are required....","Philadelphia, PA",,Director of Child Care
Required license or certification:. Obtain Pennsylvania Real Estate Salesperson License within one year of start date....,"Philadelphia, PA",,Property Management Assistant
"Effectively using tools such as the College’s web site, Contact Center Manual, Catalog and other publications to remain current and accurately respond to...","Willow Grove, PA",,Customer Service Representative
Advocate USA. Associate's degree from an accredited college or,"Plymouth Meeting, PA",,Client Service Manager - Healthcare
"with major course work in business administration, liberal arts, public","Philadelphia, PA",Campus Living Villages,Assistant General Manager
",...","Plymouth Meeting, PA",,Research Associate - Healthcare
Relations with Various,"Philadelphia, PA",,Patient Services Associate
COME FACE-TO-FACE WITH THE FUTURE OF AWESOME Give your sales career The power of XFINITY XFINITY’s suite of products and services offer customers just about,"Downingtown, PA",,XFINITY Sales Associate
"brings together the best in media and technology. If you share in our passion for teamwork, our vision to revolutionize industries and our goal to lead...","Philadelphia, PA",,"Director, Strategic Programs- Customer Experience"
brings together the best in media and technology.,"Philadelphia, PA",,"Director, Program Management"
"Field Operations is responsible for field engineering, construction and technical operations...","Philadelphia, PA",,Administrative Assistant
,"Trenton, NJ",,"Communication Technician 1, Installation & Service"
"Design and manage a flexible, automated","Berwyn, PA",,Automation Engineer- IT
provisioning framework that facilitates the rapid expansion and contraction of,"Philadelphia, PA","Hanger,",Area Office Manager
as needed....,"Berwyn, PA",,Organizational Development Practitioner
All inquiries will be directed to Human,"Berwyn, PA",,Receptionist cum Office Assistant
".*. A job with Hanger, one of the leading clinical authorities in the provision of","Philadelphia, PA",,"Coordinator , Enterprises operations"
We’ll also continue to develop our business in the territory through wholesale and ecommerce channels as we seek to increase our market share....,"King of Prussia, PA",,Sales Associate USA
Required license or certification:. This allows everyone to learn our business from the ground up and understand how they play a significant role in seeing it...,"Conshohocken, PA",,Management Trainee
Design and develop technical documentation using established standards; Improve documentation by evaluating internal process tools and interviewing technical...,"Conshohocken, PA",,Technical Writer
"Applicants must have a valid state driver’s license, a safe driving record, and at least two years of. Please ensure you can receive email messages from our...","Conshohocken, PA",,CITY CARRIER ASSISTANT
"Monitor changes in payroll related data, and answer payroll and benefits related questions from employees and budget owners....","King of Prussia, PA",,Human Resources Assistant Part-Time
And a workshare partner of the,"Levittown, PA",,Driver IV (CDL A)
Required license or certification:. The parts driver is the front line of our parts business and must have the ability to represent our company in a...,"Doylestown, PA",Fred Beans Family of Dealerships,Parts Delivery Driver
"A good drivers license is a must.Those of good character can do very well with us. Call now for your appointment...1-888-872-4602...bring your resume', current...","Doylestown, PA",FRED BEANS FORD-LINCOLN,AUTO SALES-NO EXPERIENCE NEEDED
"Perform a quality review of each page of the prepped and scanned batch in a screen to batch, page by page analysis for indexing....","Bethlehem, PA",,Document Imaging Specialist - 3rd Shift
"Insurance verification, answering phones, and general office duties. Permanent part-time position for an Insurance Office Assistant....","Fountainville, PA",,Insurance Office Assistant
"No phone calls please. At times, data entry and updating the website may be required, so attention to detail and communicating with our team is very important....","Warrington, PA",,Customer Service Representative for Office Position
We’ll also continue to develop our business in the territory through wholesale and ecommerce channels as we seek to increase our market share....,"King of Prussia, PA",,Sales Associate USA
We’ll also continue to develop our business in the territory through wholesale and ecommerce channels as we seek to increase our market share....,"King of Prussia, PA",,Stock Associate USA
"If you answered YES to all of the above I think Snap Kitchen might just be for you. First of all Snap Kitchen would like to say, You’re Welcome!...","Philadelphia, PA",,Packager
_A fast and growing Home Care Agency in North Philadelphia is looking for a full time Front Desk Receptionist /Data Entry Clerk to join its workforce._....,"Burlington, NJ",,Receptionist /Data Entry Clerk
