description,city,company,jobs
"No phone calls please. At times, data entry and updating the website may be required, so attention to detail and communicating with our team is very important....","Philadelphia, PA",,Customer Service Representative for Office Position
HP Hood,"Philadelphia, PA",HP Hood,CDLADriver
", one of the largest branded dairy operators in the U.S. For over 160 years, is seeking a Class A Driver to join its Philadelphia operation....","Philadelphia, PA",BEARX,Independent Healthcare Sales Consultant
BEARX,"Glen Mills, PA",New Carbon Company,Marketing Coordinator
"cards can be used at over 67,000 pharmacies nationwide and provide discounts of up to 80%. Our goal at BEARX","Philadelphia, PA",,Care Account Liaison
is to help out these people who are...,"Philadelphia, PA",,Receptionist
Make independent decisions and utilize sound judgment. Advanced knowledge of all Retail and Small business products and services and fluency in business acumen...,"Philadelphia, PA",,Branch Manager - 20th & Market
"Responsible for supporting the development and launch of new Comcast Business Voice, Data and Video products and features through conception, definition,...","Philadelphia, PA",,"Program Manager, Product Effectiveness"
Bachelor’s degree required curriculum in Engineering strongly preferred. Drive functional sales initiatives and campaigns throughout Area in partnership with...,"Linden, NJ",,Territory Sales Manager
"Supervises the Administrative Services Department which includes receptionist and other various administrative services employees in the areas of Documentation,...","Princeton, NJ",,Director of Administrative Services
"The Front Desk Coordinator performs, organizes, and prioritizes clerical functions with the Physical Therapy Department....","Lehigh Valley, PA",,Front Desk Coord
"The EST Desk Representative is part of that team and is responsible for the day-to-day phone/technical support of the Customer Base, Field Technicians,...","Allentown, PA",,EQUIPMENT SUPPORT TEAM (EST) DESK REPRESENTATIVE
"Responsibilities include phone registration of patients, insurance verification, therapist credentialing, generating and analyzing reports for practice...","Jenkintown, PA",Mental Health Private Practice,"Administrative Assistant, 3 years experience REQUIRED"
"Receptionist duties include greeting and directing guests/clients and attorneys, forwarding calls, logging in packages and taking messages....","Woodbridge, NJ",Gill & Chamas,File Clerk/Receptionist
"This position is also responsible for answering incoming calls, directing calls to appropriate personnel, mail distribution, flow of correspondence, requisition...","Cranbury, NJ",,Receptionist/Office Assistant
"Provides administrative and clerical support including correspondence, typing, filing, research, and various projects....","Abington, PA",,Administrative Assistant
Ability to work on own initiative and be self-motivated·. Providing sound technical advice and support. Resolving all PC/Laptop related problems logged through...,"Parsippany, NJ",Confidential - Financial,Entry Level IT Technician
"Express Scripts is a VEVRAA Federal Contractor. We are an Equal Opportunity Employer, making decisions without regard to race, color, religion, sex, national...","Burlington, NJ",,Pharmacy Production Clerk
"If you answered YES to all of the above I think Snap Kitchen might just be for you. First of all Snap Kitchen would like to say, You’re Welcome!...","Philadelphia, PA",,Packager
_A fast and growing Home Care Agency in North Philadelphia is looking for a full time Front Desk Receptionist /Data Entry Clerk to join its workforce._....,"Iselin, NJ",,Receptionist /Data Entry Clerk
"No phone calls please. At times, data entry and updating the website may be required, so attention to detail and communicating with our team is very important....","Bethlehem, PA",,Customer Service Representative for Office Position
"Please state which shift you are applying for. Currently, we are looking for more dedicated people to join our team!...","Fanwood, NJ",Dunkin Donuts,Crew Member
"Currently, we are looking for more dedicated people to join our team! Part-time & Full-time shifts are available. -10pm-6am 126 E. Edgar Rd Linden, NJ *","Linden, NJ",Dunkin Donuts,Overnight Crew Member
We see great need with exceptional growth potential for this service line and are looking to develop a world class program....,"Bethlehem, PA",St. Luke's Hospital & Health Network,Rheumatology Opportunity 60 miles north of Philadelphia
"Tuition reimbursement - If you are currently working toward obtaining your CDL or have recently graduated from driving school, we'll make your monthly tuition...","Upper Darby, PA",,Student Driver Jobs - $4k in Tuition Reimbursement
"The Last Mile division of XPO Logistics is looking for an independent contractor (1099) for the delivery and assembly of fitness equipment, white glove baby...","Whitehall Township, PA",,DELIVERY AND ASSEMBLY TECHNICIAN
Class A CDL - 6 months Tractor Trailer Experience - 23 Years of Age - Good MVR/DAC - Stable Work History - Criminal Background History Subject to Review - Must...,"Camden, NJ",,Truck Drivers Needed! Dedicated Route! Home Weekly! (6939023...
"Tuition reimbursement - If you are currently working toward obtaining your CDL or have recently graduated from driving school, we'll make your monthly tuition...","Upper Darby, PA",,Student Driver Jobs - $4k in Tuition Reimbursement
Seeking CDL A Truck Drivers for OTR Runs. Class A CDL. Newly hired experienced solo OTR drivers earn up to $0.425 per mile. Company Driver Benefits....,"Palmer, PA",,Company Driver Jobs: XPO Hiring Now
Seeking CDL A Truck Drivers for OTR Runs. Class A CDL. Newly hired experienced solo OTR drivers earn up to $0.425 per mile. Company Driver Benefits....,"Philadelphia, PA",,Company Driver Jobs: XPO Hiring Now
"If you're ready to give us your best, let's talk. Bachelors' degree, preferably in Logistics Management, or equivalent experience....",United States,,Bilingual Warehouse Supervisors 1st Shift - Supply Chain
"21 years of age or older, with a Class A commercial driver’s license. No BACs, DUIs, DWIs or license suspensions for moving violations in the past five years*....","Swedesboro, NJ",,Professional Company Driver ù safe drivers earn more
"Develop a strong training culture and makes sure company tools and programs are consistently implemented. Strong cognitive skills, including problem analysis,...","Springfield, PA",,Executive Team Leader (Assistant Store Manager) Human Resour...
"As an Executive Team Leader in training, you'll take the lead as you… Drive sales by overseeing the guest service and merchandising of two to three departments...","Springfield, PA",,Executive Team Leader (Assistant Store Manager) Delaware/Che...
As an Executive Team Leader - Overnight Logistics you'll take the lead as you… Manage the day-to-day operations of the logistics team (early morning/overnight...,"Springfield, PA",,Executive Team Leader (Assistant Store Manager) Logistics Ov...
"Offer a fast, fun and friendly guest experience. Target merchandise discount. Deliver a great-looking, fully-stocked sales floor....","Manalapan, NJ",,Logistics Team Member
"Maintain a clean, great-looking store Neatly arrange items on shelves Work with the store team to quickly to resolve guest concerns *....","North Wales, PA",,Seasonal Just-in-Time Team Member
"2 Years Tractor Trailer Driving Experience. George Hildebrandt, Inc - a regional flatbed transportation company, is looking for experienced owner operators and...","Township of Washington, NJ","George Hildebrandt, Inc",Local/Regional Flatbed Driving Job for Company Drivers
"2 Years Tractor Trailer Driving Experience. George Hildebrandt, Inc - a regional flatbed transportation company, is looking for experienced owner operators and...","Township of Washington, NJ","George Hildebrandt, Inc",$2500 Sign-On Bonus for Local/Regional Flatbed Drivers
"2 Years Tractor Trailer Driving Experience. George Hildebrandt, Inc - a regional flatbed transportation company, is looking for experienced owner operators and...","Township of Washington, NJ","George Hildebrandt, Inc",Local/Regional Flatbed Job with No-Touch Freight
"2 Years Tractor Trailer Driving Experience. Possessing year-round freight, we understand what truck driving is all about....","Califon, NJ",,Flatbed Driving Jobs | Drop and Hook Freight
"2 Years Tractor Trailer Driving Experience. Possessing year-round freight, we understand what truck driving is all about....","Califon, NJ",,Flatbed Driving Jobs for Company Drivers
"What does it take to coordinate the flow of hundreds of thousands of products to the front doors of over 2.2 million customers? RDC – Breinigsville, PA*....","Breinigsville, PA",The Home Depot,General Warehouse Associates
"Must have a valid state driver s license and proof of insurance. Requires listening for customer service calls, personal pages and general information...","Broomall, PA",,Merchandising
"They provide first level escalation for customer issues and assist in the supervision, coaching and training of other Front End Associates by participating in...","Neptune City, NJ",,Cashier (9689159)
"They provide first level escalation for customer issues and assist in the supervision, coaching and training of other Front End Associates by participating in...","Bridgewater, NJ",,Cashier
Associates in a DC Office related position perform required administrative and general office/clerical duties in support of a particular functional area within...,"Cranbury, NJ",,Distribution Center Office
"At Butler Transport, we have plenty of company driver jobs for truck drivers with a Class A CDL license that would like to begin or continue their trucker...","Summerdale, PA",Butler Transport,Company Driver
"At Butler Transport, we have plenty of company driver jobs for truck drivers with a Class A CDL license that would like to begin or continue their trucker...","Summerdale, PA",Butler Transport,Company Driver Opportunities
Class A CDL. We just started the bonus program in November and we had twice the turnout than we expected which benefited both our drivers and Butler....,"Philadelphia, PA",Butler Transport,Drive for Butler Transport
"At Butler Transport, we have plenty of company driver jobs for truck drivers with a Class A CDL license that would like to begin or continue their trucker...","Philadelphia, PA",,Company Driver
"Ladders used include twelve foot ladders. Bed Bath & Beyond is remodeling the Plymouth Meeting, PA location!...","Plymouth Meeting, PA",,Temporary Overnight Retail Associate Positions
Training clients on the use of the various on-line tools available to them. Bachelor’s degree or equivalent and a minimum of 3-4 years of work experience in...,"Plymouth Meeting, PA",,"FIA Consultant, MMS"
"Must successfully obtain required state licenses. Ability to type/keyboard and use the telephone. Diverse, welcoming culture with Employee Resource Groups....","Plymouth Meeting, PA",,Medical Representative Trainee
"Bachelor’s degree in Business, Sales, Marketing, or any related field. Develop a community presence by networking with local leaders and associations....","Plymouth Meeting, PA",,Job Recruiter
"The Alarm Service Scheduler handles incoming and outgoing calls, and schedules appointments via computer. Make and receive phone calls....","Plymouth Meeting, PA",,Alarm Service Scheduler
"Prior experience working in a Municipal Engineering office, a plus. Preparation and proofreading of correspondence, letters, memos, reports, project...","Exton, PA","Maser Consulting, P.A.",Administrative Assistant
"Mailing or transmitting claims within established filing limits. Interested candidates who live in the Exton, PA area please respond with a copy of your resume...","Exton, PA",,Accounts Receivable Representative
"Applicants should possess good interpersonal and computer skills, a professional and persuasive personality, and be prepared to learn about the vehicles we sell...","Exton, PA",Roberts Chevrolet,Automotive Sales/Internet Sales Representatives
Answering phones and routing calls. Ront desk receptionist. Data entry and other clerical and support tasks as requested. Receptionist experience preferred....,"Exton, PA",,Receptionist- Entry Level
"Description Description: To review individual job descriptions, please visit http://careers.gamestop.com/career-areas/retail-staff-jobs/ and select the","Exton, PA",,Retail Staff (Store 0637)
"Infiana USA, Inc., a growing international manufacturer of high-grade specialty plastic films used in industrial and construction applications, seeks a...","Malvern, PA","Infiana USA, Inc.",Quality Control Inspector
"This includes but is not limited to deliveries, unloading of freight, proper receipt of purchase orders, put-aways, restocks, timely and accurate transactions....","Malvern, PA",,Warehouse Lead (Inbound)
" Valid driver’s license required.  Monitor efficiency of equipment and electrical systems such as air conditioning controls, guests entrance/access doors,...","Malvern, PA","Sonesta ES Suites Malvern, PA",Maintenance Technician
"Take incoming calls from customers who are placing orders, inquiring about our products, returning product, etc. Enter and process orders/returns Answer...","Malvern, PA",,Customer Service Rep (Americanmuscle.com)
"Educational background in Business, Technology, or Healthcare field. Cerner is transforming health care by developing tools and technologies that make it easier...","Malvern, PA",,Delivery Consultant
We have plenty of work and if you are an employee of a company and want to look into starting your own business opportunitiy or work for an independent...,"Philadelphia, PA",Spirit Delivery,In Home Delivery Teams / Drivers
Response to Help Desk Calls. Follow up on existing calls (100%). Maintain average speed of answer metric (within 30 seconds). Remote Support Tools (i.e....,"Parsippany, NJ",Asset Inventories Inc.,Portuguese and Spanish Language IT Phone Support
The Financial Assistant Representative screens applicants for Charity Care/Compassionate Care and Presumptive Eligibility Medicaid in accordance with State...,"Edison, NJ",,Financial Assistant Representative
"In addition, this individual is tasked with creating presentations, updating manuals and coordinating mass mailings.This position is also responsible for...","Fort Washington, PA",,Receptionist/Administrative Assistant
"This position is also responsible for answering incoming calls, directing calls to appropriate personnel, mail distribution, flow of correspondence, requisition...","Philadelphia, PA",,Receptionist/Office Assistant
"Is an Equal Opportunity Employer.All qualified applicants will receive consideration for employment without regard to race, color, national origin, religion,...","Philadelphia, PA",,Hiring Retail Event Stock Associate
Full understanding of basic principles of Good Manufacturing Practices as well as clinical trial packaging such as separation and identity of drug products used...,"Allentown, PA",,Quality Specialist--022994
Process the financial aid application process with incoming Freshmen families. Process cash receipts. _“ … to nurture and challenge young women and men to...,"Philadelphia, PA",Cristo Rey Philadelphia High School,Part-Time Assistant to Director of Finance and Operations
"Current FBI, Pennsylvania State Police, and Department of Public Welfare criminal and child abuse clearances are required....","Philadelphia, PA",,Director of Child Care
"Effectively using tools such as the College’s web site, Contact Center Manual, Catalog and other publications to remain current and accurately respond to...","Breinigsville, PA",,Customer Service Representative
Ability to work on own initiative and be self-motivated·. Providing sound technical advice and support. Resolving all PC/Laptop related problems logged through...,"Parsippany, NJ",Confidential - Financial,Entry Level IT Technician
"The EST Desk Representative is part of that team and is responsible for the day-to-day phone/technical support of the Customer Base, Field Technicians,...","Allentown, PA",,EQUIPMENT SUPPORT TEAM (EST) DESK REPRESENTATIVE
"Photocopying, Printing, Faxing, Opening/Sorting Mail, Scanning Petitions, Updating databases daily; Fast paced, high volume corporate immigration firm seeks...","Iselin, NJ","Nair Law Group, APC",Receptionist/Administrative Assistant
_A fast and growing Home Care Agency in North Philadelphia is looking for a full time Front Desk Receptionist /Data Entry Clerk to join its workforce._....,"Burlington, NJ",,Receptionist /Data Entry Clerk
"No phone calls please. At times, data entry and updating the website may be required, so attention to detail and communicating with our team is very important....","Bethlehem, PA",,Customer Service Representative for Office Position
Sales Representative - 10 Weeks Training - 76420 Description Advance your career at Liberty Mutual - A Fortune 100 Company! Liberty Mutual Insurance,"New Providence, NJ",,Sales Representative - 10 Weeks Training
"Nuix is a worldwide provider of information management technologies, including eDiscovery, electronic investigation and information governance software. Nuix","Conshohocken, PA",,Technical Writer
Quality 1st Basement Systems is growing! This is an exciting opportunity to grow your Service Technician career and experience unlimited earning potential in,"Cliffwood, NJ",Quality 1st Basement Systems Inc.,Service Technician
"Financial Investigators - Asset Forfeiture -Philadelphia - 16000506 ASRC Federal Mission Services, a subsidiary of ASRC Federal Holding Company, is","Philadelphia, PA",,Financial Investigators - Asset Forfeiture -Philadelphia
"Position Overview: The Account Executive I will lead all Field Sales aspects of the business relationship with Wawa, a fast-growing, industry-leading customer","Berwyn, PA",,Account Executive I – Wawa Field Sales
"Must be proficient MS Office Suite, including intermediate to advanced Excel. Develop Web Analytics Reports & Dashboards (Monthly/Weekly/Daily) to measure...","East Hanover, NJ",Capitol Lighting / 1800Lighting.com,eCommerce Merchandise Coordinator
Sales Representative - 10 Weeks Training - 76420 Description Advance your career at Liberty Mutual - A Fortune 100 Company! Liberty Mutual Insurance,"New Providence, NJ",,Sales Representative - 10 Weeks Training
Execute marketing campaigns to spread the word about Lyft on campus and in your city. Earn in Your Free Time....,"Philadelphia, PA",,Brand Ambassador
This position may also be responsible for other tasks and duties as assigned. Proficiency in the Microsoft Office Suite is required....,"Fort Washington, PA",,Development Officer
"Excellent communication skills, analytical skills, and attention to detail. Ability to handle confidential materials....","Glen Mills, PA",,Team Lead
"ESSENTIAL DUTIES AND RESPONSIBILITIES:  * Hiring of Direct Support Professionals. * Assigning and scheduling staff. * Supervising Staff, providing them with","Port Monmouth, NJ",Center for Family Support,Residential Manager
"Reports directly to the Billing Team Leader. The Billing Specialist is responsible for various functions vital to billing operations, such as Charge Control,","Philadelphia, PA",,Billing Specialist
"Full time administrative assistant with 3+ years experience for friendly mental health practice, 2 days in Center City and 3 days in Jenkintown....","Jenkintown, PA",Mental Health Private Practice,"Administrative Assistant, 3 years experience REQUIRED"
"Elegant Furniture & Lighting, Inc. is a designer and manufacturer headquartered in Philadelphia, PA. Since its inception in 2000, Elegant Lighting has made","New Providence, NJ",,Customer Service Representative
"The Office Assistant is the face of the clubhouse and business office at Bala Golf Club, a private, member-owned golf club. He/she will report directly to the","Philadelphia, PA",,Office Assistant
"Nuix is a worldwide provider of information management technologies, including eDiscovery, electronic investigation and information governance software. Nuix","Conshohocken, PA",,Technical Writer
"Earn in Your Free Time Brand Ambassadors are key players at Lyft. You're in charge of growing Lyft in your city, with the flexibility of promoting on your","Philadelphia, PA",,Brand Ambassador
"Phoebe Ministries a not-for-profit, Continuing Care Retirement Community centrally located in the Lehigh Valley, is seeking interested candidates to join our","Allentown, PA",,"Administrative Assistant, Finance Department"
"Einstein Healthcare Network is a private, not for profit organization with several major facilities and many outpatient centers. Our primary mission is to","Philadelphia, PA",,Admissions/Discharge Coordinator
"About the Agency Earth Day is every day at EPA! At EPA, you can protect human health and the environment of all Americans, and you’ll discover that EPA is","Elkins Park, PA",,Student Trainee (Public Affairs)
Highly successful Philadelphia based machine manufacturer in business since 1905 requires experienced Quality Control inspectors for its rapidly expanding,"Philadelphia, PA",(Independent Recruiter),Machine Shop Q.C. Inspector
The responsibilities for this position may include some or all of the following: › Prepare cash and currency reconciliations to all counterparty accounts for,"Oaks, PA",,"IMS - Fund Accountant, Alternative Investment Funds"
Do you have a passion for helping people be successful? Do you excel working independently? As a Community Support Specialist at Via you will provide direct,"Bethlehem, PA",,Community Supports Specialist
A fast and growing Home Care Agency in North Philadelphia is looking for a full time Front Desk Receptionist /Data Entry Clerk to join its workforce. *Job,"South Plainfield, NJ",,Receptionist /Data Entry Clerk
CLINIC ASSISTANT AMBULATORY CARE Coordinates medical treatments and diagnostic activities/aspects of clinical care to patients in Ambulatory Care Area under,"South Plainfield, NJ",,Clinic Assistant - Full Time Day Shift
_A fast and growing Home Care Agency in North Philadelphia is looking for a full time Front Desk Receptionist /Data Entry Clerk to join its workforce._....,"Parsippany, NJ",,Receptionist /Data Entry Clerk
"In addition, this individual is tasked with creating presentations, updating manuals and coordinating mass mailings.This position is also responsible for...","Bethlehem, PA",,Receptionist/Administrative Assistant
"This position is also responsible for answering incoming calls, directing calls to appropriate personnel, mail distribution, flow of correspondence, requisition...","Allentown, PA",,Receptionist/Office Assistant
