city,company,jobs,description
"Langhorne, PA",,Cashier/Customer Service Representative,Seeking Professional dedicated team member to answer all incoming phone calls and directing them to the proper department.Recieve and record payments from...
"Stroudsburg, PA",Auto Dealership,Front Desk Coordinator/Receptionist,Experienced Front Desk Coordinator needed for a Luxury salon in our NEW Location Srtroudburg PA. Perform Receptionist duties as needed....
"Philadelphia, PA",Keratin Lounge PA,Service Technician,Maintain valid motor vehicle license and safe driving record. Must possess valid drivers license. Required license or certification:....
"Bethlehem, PA",Bonded Filter Company,(2) Full-time Custodian,"Possess a valid Pennsylvania driver's license. Operate buffer, floor-care machines, vacuums, drills, and other small power tools...."
"Philadelphia, PA",,In-Process QA Associate (3rd shift),Perform incoming inspections and outgoing inspections of finished product batches. Data Entry of Finished Product Information into the APR (Annual Product...
"Exton, PA",Medical Office,Front Desk Position,"Busy Medical office seeks a team player who can handle phones, check in and out of patients. Looking for a very responsible person with an amazing energy level,..."
"Exton, PA",The Protection Bureau,2nd Shift Dispatcher,"Paid time off, 401(k) matching program, medical, vision, dental. The Protection Bureau is seeking a 2nd shift, 2 - 10 PM, full time Dispatcher for our Exton..."
"Exton, PA",,Line Cooks - Start at $11+ per hour!,We're Hiring: Line Cooks If you are: A strong Team Player A Good communicator Organized with a great attention to detail At least 16 years old Able to
"Exton, PA",Red Robin Franchisee - Lehigh Valley,Server,"American Fare, Sports, and Spirits is our motto, and treating guest, as well as our staff as family is our number one priority...."
"Exton, PA",,Administrative Assistant,"Working with Company travel, arrange travel for department personnel 15 % Create and maintain information within Company electronic systems (such as Concur) and..."
"Trenton, NJ",,"Junior Recruiter - Trenton, NJ","Meet with clients and hiring managers to discuss needs and obtain candidate feedback Provide ongoing client and associate service through phone calls, in-person..."
"Trenton, NJ",Integrity Staffing Solutions,After- School Program Teacher - Part Time,"They help develop and implement a program curriculum, which fosters the clubs goals and mission. They need to develop a safe, fun and learning environment,..."
"Trenton, NJ",Boys & Girls Clubs of Mercer County,Pest Control Technician,Must have a valid driver's license and driving record up to company standards. Required license or certification:. Pesticide Applicator License....
"Trenton, NJ","Tri-County Termite & Pest Control, Inc.","Executive Administrative Assistant, Yardley, PA","Executive Administrative Assistant needed in Yardley, PA on a long term contracted basis. Must have experience supporting C Suite Executives...."
"Trenton, NJ",,Inventory Management Representative,"A family owned company, The Hibbert Group is employee focused and offers an attractive compensation and benefits package including a choice of health plans,..."
"Mount Laurel, NJ",,Retail Processor,"Reviewing and processing the components of each mortgage loan, including income, credit, appraisal, assets and title...."
"Mount Laurel, NJ","American Financial Resources, Inc.",Front Desk Associate,"To assist guests efficiently, courteously and professionally in all Front Desk related functions also to maintain the company's high level of guest service,..."
"Mount Laurel, NJ",,Receptionist - Veterinary Hospital,"Route calls to the proper staff members, answer inquiries about services and/or products and provide knowledgeable advice concerning care and treatment of..."
"Mount Laurel, NJ",Hampton by Hilton,Order Processing Coordinator,"Answer incoming calls from customers as well as field sales organization. Process customer orders, change orders, and returns received via hard copy, telephone..."
"Mount Laurel, NJ",Mount Laurel Animal Hospital,Fingerprinting Customer Service Representative,"And Fitness Determination and Adjudication services for corporations, non-profits and local, state and federal governments...."
"West Chester, PA","System Freight, Inc.",DISTRICT OPERATIONS MANAGER - DEDICATED TRUCKING,"Vehicle allowance, fuel card and travel reimbursement, expenses, etc.Must be a hands-on leader, operationally savvy, adaptable & flexible with good business..."
"West Chester, PA",Company Confidential - Building Maint & Facilities Services,Account Manager/Customer Service,"Must have valid driver’s license. Promote and teach safe on-site practices to current staff, vendors, and contractors...."
"West Chester, PA",LCOR Incorporated,Maintenance Technician,Must have a valid driver’s license and reliable transportation. Pool Certification (if required by State/County). Must be HVAC Certified....
"West Chester, PA",,"Unit Coordinator, Labor and Delivery","Responsible for general office management, clerical and receptionist duties on the Nursing Unit. Calls the Siemens Help Desk on behalf of staff and initiates..."
"West Chester, PA",,Administrative Assistant,Answers phone calls in a friendly and professional manner. Manages clerical support queues. Coordinates all outgoing FedEx shipments and supplies....
"Cherry Hill, NJ","P.J. Fitzpatrick, Inc.",Sales Representatives,"Good driving record. If your answers are YES, you need to send in your resume!! Great income and incentives. Professional demeanor and appearance...."
"Cherry Hill, NJ",,"Seasonal Retail Receiving, Part Time: Macy's Cherry Hill Mal...","The Seasonal Retail Receiving Associate is responsible for providing a great shopping experience, and driving sales and profit through customer service and..."
"Cherry Hill, NJ",Macy's,Financial Analyst,"CPA or other technical license preferred. Work with internal rates, operations and engineering groups to develop and document the assumptions to use with each..."
"Cherry Hill, NJ",,Bookseller - Cherry Hill,Greet every customer with a smile and offer assistance immediately. Ring purchases on the cash register (booksellers must be 18 to run a register)....
"Cherry Hill, NJ",American Water,Dental Receptionist,"Patient check-in and out, answer and manage calls, schedule appointments, calling insurance carriers for benefits, collect payment, inform patients of dental..."
"Newark, DE",,Desktop Tech Support Help - Utility Company,Candidates who have the field experience should submit a resume. The job is a contractor assignment as a Desktop Tech Support for a Utility Company in New...
"Newark, DE",Creative Options,Fraud Analyst / Claims Reviewer,"Complete inbound and outbound calls and take appropriate action based on transaction characteristics, varying in complexity...."
"Newark, DE",Pionear Recruiting,Building Maintenance Technician,"Light electrical, carpentry, plumbing, painting, HVAC certification, must be available for on-call rotation...."
"Newark, DE","Altman Management Company, Inc.","3rd shift: Machine Operator 1, Document Fulfillment Services...",Demonstrated mechanical aptitude. Assessment that incumbent has the ability to progress to the next level of skills and competence (Machine Operator II / III)....
"Newark, DE",,Scheduler-BC & Imaging Job,"Christiana Care Health System is an equal opportunity employer, firmly committed to prohibiting discrimination, whose staff is reflective of its community and..."
"Reading, PA",,"Food Service Worker A (Berks-Reading, PA)","Penn State is an equal opportunity, affirmative action employer, and is committed to providing employment opportunities to all qualified applicants without..."
"Reading, PA",Pennsylvania State University,Manufacturing Associate (Direct Hire w/ advancement opportun...,"Minimum of 1-3 years work related experience (automotive, manufacturing, painting, hand tools or warehouse). We are Hiring Immediately - Full Time + Benefits ..."
"Reading, PA",,Inventory Specialist/Clerical - Materials Mgnt - Full Time -...,Valid Pennsylvania Driver’s License is required. Provide customer service directing calls for both the medical center and Berks Medical equipment....
"Reading, PA",McGrath Systems,Sales Consultant,No previous experience in our field is necessary. Full-Time Front Office Assistant to help manage patient flow and generate appointments....
"Reading, PA",,PSE SALES & SVCS/DISTRIBUTION ASSOCIATE,Please ensure you can receive email messages from our test vendor and follow instructions carefully so you can be....
"Bethlehem, PA",,Sort Observation for Package Handler,"Ability to use basic tools and equipment such as skate wheel rollers, dock carts, hand-held scanners, chutes and unloading devices...."
"Bethlehem, PA",Fed-Ex Ground,Insurance Agent (Bethlehem),Valid Driver’s license and good driving record. Property and Casualty Insurance license required by. Join our exclusive team of Sales Agents....
"Bethlehem, PA",,Brand Ambassador / Sales Associate (Musikfest),Thousands of people have already contributed to advancing the future of healthcare&mdash;and to safeguarding their own future health....
"Bethlehem, PA",AAA East Central,Optometric Office Assistant,Primary responsibilities will be front desk but will also include some patient testing and assisting with patient care....
"Bethlehem, PA",ORIG3N,Medical Assistant and Medical Receptionist,The position also has some front desk reception and administrative duties as part of the position. Second position is for a Medical Receptionist....
"King of Prussia, PA","Colonial Supply Co., Inc.",Warehouse Associate - All shifts,"Ability to read and comprehend simple instructions, short correspondence, and memos. Uses forklifts and other machinery to receive and stock inbound freight...."
"King of Prussia, PA",ImageFIRST Healthcare Laundry Specialists,Business Data Analyst,"Conduct data analysis and make recommendations (cost-benefit, forecasting, and impact analysis). Predictive Analysis and Regression Analysis...."
"King of Prussia, PA",,Floating Leasing Consultant,Must have valid Drivers License. Required license or certification:. Adheres to federal and state Fair Housing Laws as well as all company policies....
"King of Prussia, PA",Westover Companies,Clinical Support Associate,Highly preferred but not required AAMA certified Medical Assistant or American Medical Technologist/Registered Medical Assistant (RMA....
"King of Prussia, PA",,Entry Level Customer Relations,The Entry Level Customer Relations position is an entry level position in our firm with the unlimited opportunity for advancement only offered in a...
"Princeton, NJ",Princeton International School of Math and Science,Receptionist/Office Assistant,"To be responsible for the signing in of visitors to the school and to communicate with courtesy and clarity to all staff, pupils, parents, visitors, outside..."
"Princeton, NJ",,Human Resource Generalist,Liaise with managers and supervisors to assess training needs and develop programs to achieve objectives. Own and coordinate payroll activities for the entire...
"Princeton, NJ",Logic Technology Development LLC,Floral Designer/Customer Service,"Design arrangements according to order specifications. Floral design experience is preferred, but we are willing to train the right person.*...."
"Princeton, NJ",Monday Morning Flower and Balloon Co.,Product Safety Coordinator Job,"Performs data entry of technical complaints and non-serious adverse events into the complaint and safety databases, including but not limited to:...."
"Princeton, NJ",,Part Time Volunteer Coordinator,"Competence with Excel, PowerPoint, Publisher, Microsoft Word and social media. Maintain volunteer contact information, number of hours volunteered and record..."
"Allentown, PA",Labs Inc.,Pick-Up Cable TV Equipment,"Valid driver's license and insurance. You will use our ROUTING SYSTEM on your phone or tablet, to get turn by turn directions.When you get to an address you..."
"Allentown, PA",,Transportation Security Officer (TSO),"Applicants must not have delinquent Federal or State taxes, past due child support payments, and must not have defaulted on $7,500 or more in delinquent debt ..."
"Allentown, PA",Transportation Security Administration,Administrative Assistant/Booker,"Answering phones with multiple lines. Social media account management. We specialize in personal development as well as developing models/actors for print, TV,..."
"Allentown, PA",Image International Modeling and Acting Center,Tumor Registrar Trainee,"Obtains a combination of computer based skills, develops knowledge, techniques, skills, and competencies required for accreditation for entry level, through on..."
"Allentown, PA",,Clerk / Receptionist,"Sacred Heart Hospital Allentown, PA Department: Health Call -Part-time -Evening Shift/Flex -Evenings & E/O Weekend -High school diploma or GED -1 Year"
"Wilmington, DE",,Inside Sales Representative,"Develop partnering relationships with the sales field using the “look left, look right” concept to uncover opportunities...."
"Wilmington, DE",IntelliSource,Inside Sales Representative - Spanish Speaking,"Develop partnering relationships with the sales field using the “look left, look right” concept to uncover opportunities...."
"Wilmington, DE",,Administrative Assistant--022862-00,"Maintain busy calendars, including scheduling meetings, meeting and greeting visitors and clients, answering phones, coordinating conference rooms and meal..."
"Wilmington, DE",IntelliSource,Part-Time Office Assistant,"Front desk responsibilities including distribution of incoming calls, managing conference room scheduling, and greeting both internal and external customers...."
"Wilmington, DE",,Operator,"Once there, enter job number 2016-6204 in the Keyword Search field to find this posting and apply on-line. They are the driving force behind everything we do...."
"Philadelphia, PA",,Sales Specialist,Entry level position. Concise communication with design and production departments to ensure accurate production of customer orders....
"Philadelphia, PA",Rush Order Tees,Foodservice Equipment Sales Representative,"Required license or certification:. Our Sales Representatives must be driven and able to work independently, including developing their own route and schedule...."
"Philadelphia, PA",Sapphire Manufacturing Inc.,Sales Representatives,"Good driving record. If your answers are YES, you need to send in your resume!! Great income and incentives. Professional demeanor and appearance...."
"Philadelphia, PA","P.J. Fitzpatrick, Inc.",RECEPTIONIST,Welcome visitors and answer their requests in a professional manner. Receive and forward phone calls appropriately....
"Philadelphia, PA",,Warehouse Associate,El Asociado del Almacén del Centro de Distribución es responsable de cumplir con las órdenes de suministro de manera eficiente y segura....
"Exton, PA",,Marketing Intern,"Applicants should be pursuing a degree in marketing, business or a related field and have a basic working knowledge of e-marketing and social media fundamentals..."
"Philadelphia, PA",Keller Williams Realty,Human Resources Internship,"This internship provides an excellent opportunity to gain exposure and experience to core HR functions including recruitment, social media, on-boarding,..."
"Staten Island, NY",,INTERNSHIP NYPD Police Cadet,"We will strive to place you in a position where you can leverage your major, while testing your abilities and challenging your commitment to improving the..."
"Parsippany, NJ","ATC Healthcare Services, Inc.",Coaching/Video Intern,"Whether coaching, scouting, database building, template building, or general writing, etc. Coaching/Video Intern - Philadelphia 76ers (Philadelphia, PA)...."
"Levittown, PA",,Market Research Co-op,"Continuously develop relationships with fellow interns through social activities, community building, and networking...."
"Ardmore, PA","365HR, Inc.",Recruiting and Staffing Coordinator-Entry Level,"Bachelor's degree in a business related field, or currently in school working toward a degree Minimum of two years of administrative work experience...."
"Ephrata, PA",,Customer Service,"Friendly, CSR to answer incoming calls from clients/customers, taking orders, entering data into the specific industry software, assisting customers...."
"Jamesburg, NJ",tristarr staffing,Customer Service Coordinator,"This is a 6 month temporary assignment, after which, all employees will be evaluated for a permanent position with the client...."
"Manheim, PA",Staffing Alternatives,Painter,Seeking painter to paint apartments to prepare for new tenants. High school or equivalent....
"Limerick, PA",,"Part-Time, Temporary Inpatient Clerk Positon",Performs receptionist and clerical duties on inpatient units. At least one year of previous clerical experience in a health related field preferred....
"Philadelphia, PA",,"Communication Technician 1, Installation & Service",is an EOE/Veterans/Disabled/LGBT employer.
"Philadelphia, PA",,Business Analyst - Operations Tech,"procedures and safe work practices,. Provides written and field assessments, meeting/exceeding..."
"Philadelphia, PA",Comcast,Social Care Project Lead,Responsible for the design of systems and process for
"Philadelphia, PA",,"Communication Technician 1, Installation & Service","Business operations teams, the Operations Technology Team helps develop customer support tools &..."
"Philadelphia, PA",,Social Care Project Lead,"Responsible for managing the complete life cycle of straight-forward to moderately complex projects, including approval, planning, execution, and closeout"
"Willow Grove, PA",Confidential-Manufacturing,Payroll Clerk,"Maintains employee and DOT/Driver files according to federal and state policies and regulations. Data entry including entering all new hires, payroll changes,..."
"Paoli, PA",ONsite Mammography,Mammography Coordinator/Front Desk,"Very engaging interpersonal skills, greeting patients, checking patients in for mammography exams, confirming appointments and working in a fast paced, very..."
"Philadelphia, PA",,Screen Printer/artisan,A successful candidate is a critical thinker who prides themselves in creating high quality apparel for the end user to enjoy....
"Easton, PA",Rush Order Tees,Human Resources Assistant,"Provide clerical support including high volume typing, filing, telecommunications, scheduling and other related office functions for assigned Human Resources..."
"Pine Grove, PA",,Patient Registrar II,"Answer incoming telephone calls, assist patient and/or direct to appropriate individuals. Thomas Jefferson University and Hospitals provide excellent clinical..."
"Philadelphia, PA",,Community Service Associate,"Prepare and maintain specialty rooms - i.e. screening rooms, meditation room, recording studios. Our mission is to create a world where people work to make a..."
"Spring House, PA",WeWork,Entry-Level Management,"Responsible for implementing and maintaining compliance with all State, Federal, and Company standards for Health Care Staff, employee process, responsible for..."
"Philadelphia, PA",Epic Health Services Inc.,Receptionist,"Welcomes visitors by greeting them, in person or on the telephone; Assists with other related clerical duties such as photocopying, faxing, filing and collating..."
"Philadelphia, PA",,CUSTOMER SERVICE REPRESENTATIVE,"An Associates or Bachelors degree in business or a business related field is a plus. Proven ability to work effectively in a fast-paced work environment, both..."
"Philadelphia, PA",,Collections Assistant,Collections...
"Bala-Cynwyd, PA",Medical Alert,Inside Sales Representative,"Performing outbound sales calls with potential customers. With Medical Alert, your motivation, passion and integrity will be the cornerstone of your success..."
"Philadelphia, PA",,Outside Sales Account Manager,"Educate your customers on product alternatives, features and benefits as you help your contractors choose the best overall solution for their skyscraper, retail..."
"Philadelphia, PA",Kenseal Construction Products,Patient Services Associate,"The PSA is responsible for the arrival and/or departure activities of patients in the practice, managing and handling patient calls and inquiries, coordinating..."
"Mount Joy, PA",,WOGL-FM Part Time Air Talent,"If you’re ready to have fun in our state of the art studios, be tight-n-bright and work the phones like crazy, then we want to hear from you!..."
"Philadelphia, PA",,Events Cashier - Liacouras Center,"Experience running a cash register, knowledge of processing a credit card reader and performing credit card transactions...."
"Bensalem, PA",Paradise Management LLC,Leasing Professional,"The Leasing Professional performs all functions related to apartment leasing, including generating traffic through outreach marketing, presenting the features..."
"Eagleville, PA",Reliant at Home Care,Office Manager,"Valid Driver’s license and proper automobile insurance. Provides assistance to other administrative roles as needed, including answering the phone, copying,..."
"Philadelphia, PA",Shinola,Store Manager,"Acquire, retain and develop the best in class talent. Leverage tools and resources to exceed business objectives including but not limited to Annual Performance..."
"Harleysville, PA",,Animal Care Camp Counselor,"NO PHONE CALLS PLEASE. Must be willing to clean up messes, supervise play groups, feed, medicate, and monitor health and behavior...."
"Philadelphia, PA",Camp Bow Wow,Full time-Call Center Representative,Develop and maintain a knowledge base of the evolving products and services Qualifications. You will be responsible for helping customers by providing product...
"Philadelphia, PA",,Director of Organizational,"Working with the senior team, the Director of Organizational"
"Philadelphia, PA",Inglis Foundation,Senior Project Manager - Global PMO,will develop Inglis wide and division specific
"Cherry Hill, NJ","Partner's Consulting, Inc.",Outside Sales Technician - Security Sales,plans....
"Philadelphia, PA",,Program Ambassador Philadelphia,Leads
"Media, PA",DEFENDERS,Director of Family and Child Health,reviews and drives post-launch performance reviews. Experience in
"Philadelphia, PA",,Patient Care Coordinator,"Is looking for a Patient Care Coordinator for our Philadelphia, PA location at"
"Philadelphia, PA",SleepMed,RN / REGISTERED NURSE / TELEMETRY RN / TELEMETRY NURSE,
"Philadelphia, PA",,RN / REGISTERED NURSE / MED SURG RN / MEDICAL SURGICAL NURSE,
"Philadelphia, PA",Aureus Medical Group,Registrar Full Time,. High School diploma required and 3 years of related...
United States,,"SENIOR JAVA SOFTWARE ENGINEER, FL","What do Outback Steakhouse,"
"Allentown, PA",,General Warehouse - Up to $25 per hour,"Operate Crown forklifts, reach trucks and stock pickers. Pick, pack, receive and restock product. Manage stock and inventory control. Ensure order accuracy"
"Easton, PA",Uline,Fulfillment Associate,"That is, as long as you thrive in a fast-moving environment, don’t mind working with and around moving mechanical parts, and are okay with a little noise...."
"Easton, PA",,Assistant Innkeeper,Answer telephone courteously and efficiently following inn’s guidelines. Check guests in/out as needed. Monitor incoming email and respond as required....
"Easton, PA",Amazon HVH,Production Chemical Technician - Entry Level,"Valid driver’s license and good driving record. Full time, Monday-Friday, 6:30AM-3:00PM position production worker in a chemical manufacturing facility.Duties..."
"Clinton, NJ",The Lafayette Inn,Creative Intern,"No phone calls please. Regardless of past practice, all resumes submitted by search firms to any employee at Crayola LLC via e-mail, the Internet, or directly..."
"Easton, PA",,Production Chemical Technician - Entry Level,
"Wilmington, DE",,Technical Support Representative,"As a Technical Support Representative, you will be the initial point of contact for customers with questions about their fiber-based voice, data and/or video..."
"Wilmington, DE",Verizon,Construction Site Assistant (AmeriCorps),Required license or certification:. Assist construction staff with preparing tools and materials for the day’s tasks....
"New Castle, DE",Habitat for Humanity of New Castle County,Casual Accounting Reconciliation," 3+ years of experience in a Business related field. This position will work with various Finance staff to develop and analyze reports, interpret financial and..."
"Philadelphia, PA",Delaware River and Bay Authority,"3rd shift: Machine Operator 1, Document Fulfillment Services...",Demonstrated mechanical aptitude. Assessment that incumbent has the ability to progress to the next level of skills and competence (Machine Operator II / III)....
"New Castle, DE",,Scheduler-BC & Imaging Job,"Christiana Care Health System is an equal opportunity employer, firmly committed to prohibiting discrimination, whose staff is reflective of its community and..."
"Wilmington, DE",,"Registered Client Associate - Wilmington, DE","The Client Associate (CA) role is a sales support position, typically providing dedicated operational and sales support to multiple Financial Advisors (FA's)."
"Bear, DE",,Teller,"Everything we do, we do to protect the customer and the"
"Wilmington, DE",Bank,Treasury ALM Lead,. A Teller position with our team offers an opportunity to be part of one of
"Newark, DE",of,"3rd shift: Machine Operator 1, Document Fulfillment Services...",s greatest...
"Wilmington, DE",America,Intmd Client Onbrding Analyst 1,"The Treasury department is responsible for the management of funding, liquidity, capital and interest rate risk for the"
